"โจทก์ทั้งสองและจำเลยเป็นบุตรของนางเพ็ญแก้ว กับนายประชิต เมื่อปี 2511 และปี 2516 ตามลำดับ นางเพ็ญแก้วแต่ผู้เดียวซื้อที่ดินพิพาทโฉนดเลขที่ 1876 และ 1877 ตำบลในเมือง อำเภอเมืองนครพนม จังหวัดนครพนม ต่อมาวันที่ 12 มิถุนายน 2540 นางเพ็ญแก้วจดทะเบียนยกที่ดินพิพาทโฉนดเลขที่ 1876 ให้แก่จำเลย ต่อมาวันที่ 4 พฤศจิกายน 2540 จำเลยจดทะเบียนจำนองที่ดินพิพาทแปลงดังกล่าวเป็นหลักประกันหนี้กู้ยืมเงินของจำเลยแก่ธนาคารกรุงไทย จำกัด (มหาชน) ต่อมาวันที่ 3 พฤษภาคม 2547 นางเพ็ญแก้วจดทะเบียนยกที่ดินพิพาทโฉนดเลขที่ 1877 ให้แก่จำเลย ต่อมาวันที่ 14 กันยายน 2547 จำเลยจดทะเบียนจำนองที่ดินพิพาทแปลงดังกล่าวเป็นหลักประกันหนี้กู้ยืมเงินของจำเลยแก่ธนาคารทหารไทย จำกัด (มหาชน) ต่อมาวันที่ 18 ธันวาคม 2556 นางเพ็ญแก้วถึงแก่ความตายโจทก์ทั้งสองฟ้องขอให้พิพากษาว่า นิติกรรมการให้ที่ดินโฉนดเลขที่ 1876 และ 1877 ตำบลในเมือง อำเภอเมืองนครพนม จังหวัดนครพนม เป็นโมฆะ ให้จำเลยจดทะเบียนใส่ชื่อโจทก์ทั้งสองเป็นผู้ถือกรรมสิทธิ์ร่วมในที่ดินพร้อมสิ่งปลูกสร้างพิพาทดังกล่าว หากสภาพแห่งนี้ไม่อาจบังคับได้ให้จำเลยชำระเงินให้แก่โจทก์ทั้งสองคนละ 2,000,000 บาท พร้อมดอกเบี้ยอัตราร้อยละ 7.5 ต่อปี นับแต่วันฟ้องเป็นต้นไปจนกว่าจะชำระเสร็จแก่โจทก์ทั้งสอง
จำเลยให้การขอให้ยกฟ้อง","150, 1373",433/2560
"โจทก์ทั้งสองเป็นสามีภริยาโดยชอบด้วยกฎหมาย จำเลยที่ 1 เป็นอาของโจทก์ที่ 2 โดยเป็นน้องสาวร่วมบิดามารดาเดียวกันกับนาย ศ. บิดาของโจทก์ที่ 2 ส่วนจำเลยที่ 2 เป็นสามีโดยชอบด้วยกฎหมายของจำเลยที่ 1 และไม่มีบุตรด้วยกัน โจทก์ทั้งสองมีบุตรด้วยกัน 3 คน คือ เด็กหญิง ภ. เด็กหญิง ป. และเด็กหญิง จ. หลังจากโจทก์ที่ 2 คลอดผู้เยาว์ประมาณ 45 วัน ได้มอบผู้เยาว์ให้นาง ศ. ย่าของโจทก์ที่ 2 เป็น ผู้เลี้ยงดู จำเลยทั้งสองรับนาง ศ. และผู้เยาว์ไปอยู่ด้วยที่จังหวัดชลบุรีตั้งแต่ผู้เยาว์อายุ 2 ถึง 3 เดือน แล้วจำเลยทั้งสองเป็นผู้อุปการะเลี้ยงดูผู้เยาว์นับแต่บัดนั้นเป็นต้นมาจนถึงปัจจุบัน
โจทก์ทั้งสองฟ้องขอให้บังคับจำเลยทั้งสองร่วมกันหรือแทนกันส่งมอบผู้เยาว์คืนแก่โจทก์ทั้งสอง หากไม่ยอมส่งมอบผู้เยาว์คืนแก่โจทก์ทั้งสอง ให้ถือเอาคำพิพากษาเป็นการแสดงเจตนาของจำเลยทั้งสองแทน ห้ามมิให้จำเลยทั้งสองเกี่ยวข้องใด ๆ กับผู้เยาว์นับแต่ส่งมอบผู้เยาว์คืนแก่โจทก์ทั้งสองหรือโจทก์ทั้งสองได้รับผู้เยาว์คืน
จำเลยทั้งสองให้การขอให้ยกฟ้อง","1585,  1582  1567",515/2560
"โจทก์จดทะเบียนสมรสกับจำเลยเมื่อวันที่ 18 ธันวาคม 2529 หลังจากนั้นในปี 2534 ถึงปี 2537 จำเลยมีชื่อถือกรรมสิทธิ์ในที่ดินโฉนดที่ดิน 9 แปลง ตามฟ้อง ต่อมาวันที่ 27 มกราคม 2557 ในระหว่างพิจารณาคดีนี้จำเลยจดทะเบียนยกที่ดินโฉนดเลขที่ 69534 ตำบลแสมดำ (บางบอน) อำเภอบางขุนเทียน กรุงเทพมหานคร ให้นายภูรินทร์ ตามสำเนาโฉนดที่ดิน ต่อมาวันที่ 7 กุมภาพันธ์ 2557 จำเลยจดทะเบียนยกที่ดินโฉนดเลขที่ 88758 ตำบลแสมดำ (บางบอน) อำเภอบางขุนเทียน กรุงเทพมหานคร ให้นางสาวอารยา และในวันที่ 12 กุมภาพันธ์ 2557 จำเลยจดทะเบียนยกที่ดินโฉนดเลขที่ 88759 ตำบลแสมดำ (บางบอน) อำเภอบางขุนเทียน กรุงเทพมหานคร ให้นายภูรินทร์
โจทก์ฟ้องขอให้บังคับจำเลยไปดำเนินการใส่ชื่อโจทก์เป็นเจ้าของรวมในโฉนดที่ดินเลขที่ 69534, 88758 และ 88759 ตำบลแสมดำ (บางบอน) อำเภอบางขุนเทียน กรุงเทพมหานคร โฉนดที่ดินเลขที่ 97009 ตำบลบางบอน อำเภอบางขุนเทียน กรุงเทพมหานคร โฉนดที่ดินเลขที่ 50661 และ 50663 ตำบลสันกลาง อำเภอสันป่าตอง จังหวัดเชียงใหม่ และโฉนดที่ดินเลขที่ 2089, 2098 และ 2107 ตำบลแม่นะ อำเภอเชียงดาว จังหวัดเชียงใหม่ หากจำเลยไม่ไปดำเนินการต่อนายทะเบียนที่ดิน ให้ถือเอาคำพิพากษาแทนการแสดงเจตนาของจำเลย
จำเลยให้การและแก้ไขคำให้การขอให้ยกฟ้อง",1474,517/2560
"โจทก์กับจำเลยจดทะเบียนสมรสกันเมื่อวันที่ 29 ตุลาคม 2551 ตามทะเบียนสมรส อาวุธปืนสั้น ขนาด .45 เครื่องหมายทะเบียน กท 54241039 เจ้าพนักงานออกใบอนุญาตให้มีและใช้อาวุธปืนแก่โจทก์ตามสำเนาใบอนุญาต รถยนต์ยี่ห้อฮอนด้า หมายเลขทะเบียน ชต 6512 กรุงเทพมหานคร มีชื่อโจทก์เป็นผู้ถือกรรมสิทธิ์ ตามสำเนารายการจดทะเบียน โจทก์กับจำเลยได้ทำบันทึกข้อตกลง ตามสำเนารายงานประจำวันเกี่ยวกับคดีโจทก์ฟ้องขอให้พิพากษาให้โจทก์หย่าขาดกับจำเลย หากไม่ปฏิบัติตามให้ถือเอาคำพิพากษาเป็นการแสดงเจตนา ให้จำเลยคืนรถยนต์ยี่ห้อฮอนด้า หมายเลขทะเบียน ชต 6512 กรุงเทพมหานคร แหวนเพชร และอาวุธปืน หากคืนไม่ได้ให้ใช้ราคาแทน 440,000 บาท พร้อมดอกเบี้ยอัตราร้อยละ 7.5 ต่อปี ของต้นเงินดังกล่าว นับถัดจากวันฟ้องจนกว่าจะชำระเสร็จแก่โจทก์ ให้จำเลยแบ่งสินสมรส จำนวน 125,000 บาท พร้อมดอกเบี้ยอัตราร้อยละ 7.5 ต่อปี ของต้นเงินดังกล่าว นับถัดจากวันฟ้องจนกว่าจะชำระเสร็จแก่โจทก์ 
จำเลยให้การขอให้ยกฟ้อง",1514,520/2560
"โจทก์และจำเลยเป็นบุตรต่างสามีของนางค่ำหรือค้ำ เจ้ามรดก โดยโจทก์มีพี่น้องร่วมบิดาเดียวกันอีกสองคน คือนายบุญธรรม กับนายบรรเทิง ส่วนจำเลยเป็นบุตรคนเดียวของบิดามารดา นอกจากนี้เจ้ามรดกยังมีบุตรต่างสามีอีกหนึ่งคน คือ นายคำ เจ้ามรดกถึงแก่ความตายเมื่อปี 2531 มีทรัพย์มรดกเป็นที่ดินจำนวน 2 แปลง คือที่ดินส่วนที่ปลูกบ้านอยู่อาศัย ซึ่งเจ้ามรดกยกให้แก่จำเลยกับนายบุญธรรมคนละครึ่ง และส่วนที่ดินที่ทำนาซึ่งพิพาทกันในคดีนี้ จำเลยในฐานะผู้จัดการมรดกได้ขอออกเป็นที่ดินโฉนดเลขที่ 25153 อำเภอเมืองอำนาจเจริญ จังหวัดอำนาจเจริญ และแบ่งเป็นโฉนดย่อยให้แก่ทายาทอื่นทุกคนแล้วยกเว้นโจทก์ โดยยังเหลือที่ดินที่ยังไม่ได้แบ่งเนื้อที่ประมาณ 21 ไร่เศษ
โจทก์ฟ้องและแก้ไขคำฟ้องขอให้บังคับจำเลยเพิกถอนนิติกรรมจดทะเบียนจำนองที่ดินโฉนดเลขที่ 25153 อำเภอเมืองอำนาจเจริญ จังหวัดอำนาจเจริญ แล้วให้จำเลยนำที่ดินดังกล่าวมาแบ่งให้โจทก์กึ่งหนึ่ง เนื้อที่ 10 ไร่ 2 งาน 92.5 ตารางวา โดยให้ด้านหน้าติดถนนชยางกูรมีระยะกว้างเท่ากัน หากจำเลยไม่ยินยอมให้โจทก์ไถ่ถอนเองโดยถือเอาคำพิพากษาแทนการแสดงเจตนา ให้จำเลยชดใช้เงินที่ไถ่ถอนพร้อมดอกเบี้ยร้อยละ 7.5 ต่อปี จนกว่าจะชำระเสร็จแก่โจทก์ ให้ถอนจำเลยออกจากการเป็นผู้จัดการมรดกและกำจัดมิให้จำเลยรับมรดกของนางค่ำหรือค้ำ
จำเลยให้การขอให้ยกฟ้อง",1300 1733,520/2560
